{
  "$schema": "https://json-schema.org/draft/2020-12/schema",
  "title": "SlideMuse editable scene v1",
  "type": "object",
  "additionalProperties": false,
  "required": [
    "version",
    "canvas",
    "slides"
  ],
  "properties": {
    "version": {
      "const": "1.0"
    },
    "title": {
      "type": "string"
    },
    "canvas": {
      "type": "object",
      "additionalProperties": false,
      "required": [
        "width",
        "height"
      ],
      "properties": {
        "width": {
          "type": "number",
          "exclusiveMinimum": 0
        },
        "height": {
          "type": "number",
          "exclusiveMinimum": 0
        },
        "width_inches": {
          "type": "number",
          "minimum": 1,
          "maximum": 56
        }
      }
    },
    "slides": {
      "type": "array",
      "minItems": 1,
      "items": {
        "type": "object",
        "additionalProperties": false,
        "required": [
          "id",
          "elements"
        ],
        "properties": {
          "id": {
            "type": "string",
            "pattern": "^[A-Za-z0-9][A-Za-z0-9_.-]*$"
          },
          "title": {
            "type": "string"
          },
          "source_image": {
            "type": "string"
          },
          "background": {
            "$ref": "#/$defs/color"
          },
          "notes": {
            "type": "string"
          },
          "elements": {
            "type": "array",
            "minItems": 1,
            "items": {
              "$ref": "#/$defs/element"
            }
          }
        }
      }
    }
  },
  "$defs": {
    "color": {
      "type": "string",
      "pattern": "^#[0-9A-Fa-f]{6}$"
    },
    "nullableColor": {
      "anyOf": [
        {
          "type": "null"
        },
        {
          "$ref": "#/$defs/color"
        }
      ]
    },
    "element": {
      "oneOf": [
        {
          "type": "object",
          "additionalProperties": false,
          "properties": {
            "id": {
              "type": "string",
              "pattern": "^[A-Za-z0-9][A-Za-z0-9_.-]*$"
            },
            "name": {
              "type": "string"
            },
            "type": {
              "const": "text"
            },
            "source": {
              "type": "string"
            },
            "confidence": {
              "type": "number",
              "minimum": 0,
              "maximum": 1
            },
            "note": {
              "type": "string"
            },
            "x": {
              "type": "number",
              "minimum": 0
            },
            "y": {
              "type": "number",
              "minimum": 0
            },
            "w": {
              "type": "number",
              "exclusiveMinimum": 0
            },
            "h": {
              "type": "number",
              "exclusiveMinimum": 0
            },
            "rotation": {
              "type": "number",
              "minimum": -360,
              "maximum": 360
            },
            "text": {
              "type": "string"
            },
            "font": {
              "type": "string",
              "minLength": 1
            },
            "font_size": {
              "type": "number",
              "exclusiveMinimum": 0
            },
            "color": {
              "$ref": "#/$defs/color"
            },
            "bold": {
              "type": "boolean"
            },
            "italic": {
              "type": "boolean"
            },
            "align": {
              "enum": [
                "left",
                "center",
                "right"
              ]
            },
            "valign": {
              "enum": [
                "top",
                "middle",
                "bottom"
              ]
            },
            "margin": {
              "type": "number",
              "minimum": 0
            },
            "line_spacing": {
              "type": "number",
              "exclusiveMinimum": 0
            }
          },
          "required": [
            "id",
            "type",
            "x",
            "y",
            "w",
            "h",
            "text"
          ]
        },
        {
          "type": "object",
          "additionalProperties": false,
          "properties": {
            "id": {
              "type": "string",
              "pattern": "^[A-Za-z0-9][A-Za-z0-9_.-]*$"
            },
            "name": {
              "type": "string"
            },
            "type": {
              "const": "shape"
            },
            "source": {
              "type": "string"
            },
            "confidence": {
              "type": "number",
              "minimum": 0,
              "maximum": 1
            },
            "note": {
              "type": "string"
            },
            "x": {
              "type": "number",
              "minimum": 0
            },
            "y": {
              "type": "number",
              "minimum": 0
            },
            "w": {
              "type": "number",
              "exclusiveMinimum": 0
            },
            "h": {
              "type": "number",
              "exclusiveMinimum": 0
            },
            "rotation": {
              "type": "number",
              "minimum": -360,
              "maximum": 360
            },
            "shape": {
              "enum": [
                "rect",
                "roundRect",
                "ellipse",
                "triangle",
                "diamond",
                "chevron",
                "rightArrow"
              ]
            },
            "fill": {
              "$ref": "#/$defs/nullableColor"
            },
            "line": {
              "$ref": "#/$defs/nullableColor"
            },
            "line_width": {
              "type": "number",
              "minimum": 0
            }
          },
          "required": [
            "id",
            "type",
            "x",
            "y",
            "w",
            "h",
            "shape"
          ]
        },
        {
          "type": "object",
          "additionalProperties": false,
          "properties": {
            "id": {
              "type": "string",
              "pattern": "^[A-Za-z0-9][A-Za-z0-9_.-]*$"
            },
            "name": {
              "type": "string"
            },
            "type": {
              "const": "image"
            },
            "source": {
              "type": "string"
            },
            "confidence": {
              "type": "number",
              "minimum": 0,
              "maximum": 1
            },
            "note": {
              "type": "string"
            },
            "x": {
              "type": "number",
              "minimum": 0
            },
            "y": {
              "type": "number",
              "minimum": 0
            },
            "w": {
              "type": "number",
              "exclusiveMinimum": 0
            },
            "h": {
              "type": "number",
              "exclusiveMinimum": 0
            },
            "rotation": {
              "type": "number",
              "minimum": -360,
              "maximum": 360
            },
            "path": {
              "type": "string",
              "minLength": 1
            },
            "fit": {
              "enum": [
                "contain",
                "cover",
                "stretch"
              ]
            },
            "role": {
              "enum": [
                "asset",
                "background",
                "reference"
              ]
            }
          },
          "required": [
            "id",
            "type",
            "x",
            "y",
            "w",
            "h",
            "path"
          ]
        },
        {
          "type": "object",
          "additionalProperties": false,
          "properties": {
            "id": {
              "type": "string",
              "pattern": "^[A-Za-z0-9][A-Za-z0-9_.-]*$"
            },
            "name": {
              "type": "string"
            },
            "type": {
              "const": "line"
            },
            "source": {
              "type": "string"
            },
            "confidence": {
              "type": "number",
              "minimum": 0,
              "maximum": 1
            },
            "note": {
              "type": "string"
            },
            "x1": {
              "type": "number",
              "minimum": 0
            },
            "y1": {
              "type": "number",
              "minimum": 0
            },
            "x2": {
              "type": "number",
              "minimum": 0
            },
            "y2": {
              "type": "number",
              "minimum": 0
            },
            "color": {
              "$ref": "#/$defs/color"
            },
            "line_width": {
              "type": "number",
              "exclusiveMinimum": 0
            },
            "arrow": {
              "enum": [
                "none",
                "end",
                "both"
              ]
            }
          },
          "required": [
            "id",
            "type",
            "x1",
            "y1",
            "x2",
            "y2"
          ]
        },
        {
          "type": "object",
          "additionalProperties": false,
          "properties": {
            "id": {
              "type": "string",
              "pattern": "^[A-Za-z0-9][A-Za-z0-9_.-]*$"
            },
            "name": {
              "type": "string"
            },
            "type": {
              "const": "table"
            },
            "source": {
              "type": "string"
            },
            "confidence": {
              "type": "number",
              "minimum": 0,
              "maximum": 1
            },
            "note": {
              "type": "string"
            },
            "x": {
              "type": "number",
              "minimum": 0
            },
            "y": {
              "type": "number",
              "minimum": 0
            },
            "w": {
              "type": "number",
              "exclusiveMinimum": 0
            },
            "h": {
              "type": "number",
              "exclusiveMinimum": 0
            },
            "rotation": {
              "type": "number",
              "minimum": -360,
              "maximum": 360
            },
            "font": {
              "type": "string",
              "minLength": 1
            },
            "font_size": {
              "type": "number",
              "exclusiveMinimum": 0
            },
            "color": {
              "$ref": "#/$defs/color"
            },
            "bold": {
              "type": "boolean"
            },
            "italic": {
              "type": "boolean"
            },
            "align": {
              "enum": [
                "left",
                "center",
                "right"
              ]
            },
            "valign": {
              "enum": [
                "top",
                "middle",
                "bottom"
              ]
            },
            "margin": {
              "type": "number",
              "minimum": 0
            },
            "line_spacing": {
              "type": "number",
              "exclusiveMinimum": 0
            },
            "rows": {
              "type": "array",
              "minItems": 1,
              "items": {
                "type": "array",
                "minItems": 1,
                "items": {
                  "type": "string"
                }
              }
            },
            "column_widths": {
              "type": "array",
              "minItems": 1,
              "items": {
                "type": "number",
                "exclusiveMinimum": 0
              }
            },
            "header": {
              "type": "boolean"
            },
            "header_fill": {
              "$ref": "#/$defs/color"
            },
            "header_color": {
              "$ref": "#/$defs/color"
            },
            "fill": {
              "$ref": "#/$defs/color"
            }
          },
          "required": [
            "id",
            "type",
            "x",
            "y",
            "w",
            "h",
            "rows"
          ]
        },
        {
          "type": "object",
          "additionalProperties": false,
          "properties": {
            "id": {
              "type": "string",
              "pattern": "^[A-Za-z0-9][A-Za-z0-9_.-]*$"
            },
            "name": {
              "type": "string"
            },
            "type": {
              "const": "chart"
            },
            "source": {
              "type": "string"
            },
            "confidence": {
              "type": "number",
              "minimum": 0,
              "maximum": 1
            },
            "note": {
              "type": "string"
            },
            "x": {
              "type": "number",
              "minimum": 0
            },
            "y": {
              "type": "number",
              "minimum": 0
            },
            "w": {
              "type": "number",
              "exclusiveMinimum": 0
            },
            "h": {
              "type": "number",
              "exclusiveMinimum": 0
            },
            "rotation": {
              "type": "number",
              "minimum": -360,
              "maximum": 360
            },
            "chart_type": {
              "enum": [
                "bar",
                "column",
                "line",
                "pie",
                "doughnut"
              ]
            },
            "categories": {
              "type": "array",
              "minItems": 1,
              "items": {
                "type": "string"
              }
            },
            "series": {
              "type": "array",
              "minItems": 1,
              "items": {
                "type": "object",
                "additionalProperties": false,
                "required": [
                  "name",
                  "values"
                ],
                "properties": {
                  "name": {
                    "type": "string"
                  },
                  "values": {
                    "type": "array",
                    "minItems": 1,
                    "items": {
                      "type": "number"
                    }
                  },
                  "color": {
                    "$ref": "#/$defs/color"
                  }
                }
              }
            },
            "legend": {
              "type": "boolean"
            },
            "data_labels": {
              "type": "boolean"
            },
            "number_format": {
              "type": "string"
            },
            "font_size": {
              "type": "number",
              "exclusiveMinimum": 0
            },
            "font": {
              "type": "string",
              "minLength": 1
            }
          },
          "required": [
            "id",
            "type",
            "x",
            "y",
            "w",
            "h",
            "chart_type",
            "categories",
            "series"
          ]
        },
        {
          "type": "object",
          "additionalProperties": false,
          "properties": {
            "id": {
              "type": "string",
              "pattern": "^[A-Za-z0-9][A-Za-z0-9_.-]*$"
            },
            "name": {
              "type": "string"
            },
            "type": {
              "const": "group"
            },
            "source": {
              "type": "string"
            },
            "confidence": {
              "type": "number",
              "minimum": 0,
              "maximum": 1
            },
            "note": {
              "type": "string"
            },
            "children": {
              "type": "array",
              "minItems": 1,
              "items": {
                "$ref": "#/$defs/element"
              }
            }
          },
          "required": [
            "id",
            "type",
            "children"
          ]
        }
      ]
    }
  }
}
