{
  "version": "1.0",
  "title": "Image PPT 2.0 · 可编辑元素示例",
  "canvas": {
    "width": 1600,
    "height": 900,
    "width_inches": 13.333333
  },
  "slides": [
    {
      "id": "s01",
      "background": "#F6F5F1",
      "notes": "功能示例。图片取自本仓库历史展示，仅作为独立可替换图片素材，未声称对该图内部元素完成重建。",
      "elements": [
        {
          "id": "accent",
          "type": "shape",
          "x": 100,
          "y": 92,
          "w": 60,
          "h": 8,
          "shape": "rect",
          "fill": "#007F73",
          "line": null
        },
        {
          "id": "eyebrow",
          "type": "text",
          "x": 100,
          "y": 120,
          "w": 800,
          "h": 60,
          "text": "IMAGE PPT 2.0",
          "font": "Microsoft YaHei",
          "font_size": 18,
          "color": "#007F73",
          "bold": true
        },
        {
          "id": "title",
          "type": "text",
          "x": 100,
          "y": 210,
          "w": 850,
          "h": 210,
          "text": "图像创造视觉\n信息保持可编辑",
          "font": "Microsoft YaHei",
          "font_size": 46,
          "color": "#172B4D",
          "bold": true,
          "line_spacing": 1.12
        },
        {
          "id": "body",
          "type": "text",
          "x": 100,
          "y": 470,
          "w": 820,
          "h": 125,
          "text": "文字、形状、表格与图表保留原生结构。\n照片和插画作为独立素材，随时移动或替换。",
          "font": "Microsoft YaHei",
          "font_size": 23,
          "color": "#526173",
          "line_spacing": 1.35
        },
        {
          "type": "image",
          "id": "artwork",
          "name": "历史封面素材 · 可替换",
          "path": "silver-emotion-p1.jpg",
          "fit": "contain",
          "x": 960,
          "y": 230,
          "w": 540,
          "h": 340
        },
        {
          "id": "caption",
          "type": "text",
          "x": 960,
          "y": 595,
          "w": 540,
          "h": 45,
          "text": "独立图片素材示例",
          "font": "Microsoft YaHei",
          "font_size": 16,
          "color": "#526173"
        },
        {
          "id": "footer",
          "type": "text",
          "x": 100,
          "y": 795,
          "w": 1300,
          "h": 50,
          "text": "01 / 03   ·   本示例用于验证编辑能力",
          "font": "Microsoft YaHei",
          "font_size": 14,
          "color": "#526173"
        }
      ]
    },
    {
      "id": "s02",
      "background": "#FFFFFF",
      "notes": "全部数值均为演示数据，不对应实际业务或基准结果。",
      "elements": [
        {
          "id": "title",
          "type": "text",
          "x": 100,
          "y": 65,
          "w": 1400,
          "h": 90,
          "text": "数据可以直接修改",
          "font": "Microsoft YaHei",
          "font_size": 36,
          "color": "#172B4D",
          "bold": true
        },
        {
          "id": "subtitle",
          "type": "text",
          "x": 100,
          "y": 168,
          "w": 1400,
          "h": 65,
          "text": "原生图表附带数据工作簿，表格保留单元格。数值仅用于演示。",
          "font": "Microsoft YaHei",
          "font_size": 19,
          "color": "#526173"
        },
        {
          "type": "chart",
          "id": "performance",
          "name": "示例进度",
          "x": 100,
          "y": 280,
          "w": 800,
          "h": 450,
          "chart_type": "column",
          "categories": [
            "第一期",
            "第二期",
            "第三期"
          ],
          "series": [
            {
              "name": "示例进度",
              "values": [
                35,
                60,
                85
              ],
              "color": "#007F73"
            }
          ],
          "legend": false,
          "data_labels": true,
          "font": "Microsoft YaHei",
          "font_size": 16
        },
        {
          "type": "table",
          "id": "source-data",
          "name": "示例数据表",
          "x": 990,
          "y": 320,
          "w": 510,
          "h": 330,
          "rows": [
            [
              "阶段",
              "示例进度"
            ],
            [
              "第一期",
              "35"
            ],
            [
              "第二期",
              "60"
            ],
            [
              "第三期",
              "85"
            ]
          ],
          "column_widths": [
            1.4,
            1
          ],
          "header_fill": "#007F73",
          "header_color": "#FFFFFF",
          "font": "Microsoft YaHei",
          "font_size": 20,
          "margin": 8
        },
        {
          "id": "footer",
          "type": "text",
          "x": 100,
          "y": 795,
          "w": 1300,
          "h": 50,
          "text": "02 / 03   ·   演示数据",
          "font": "Microsoft YaHei",
          "font_size": 14,
          "color": "#526173"
        }
      ]
    },
    {
      "id": "s03",
      "background": "#F6F5F1",
      "elements": [
        {
          "id": "title",
          "type": "text",
          "x": 100,
          "y": 65,
          "w": 1400,
          "h": 90,
          "text": "结构拆开，修改更直接",
          "font": "Microsoft YaHei",
          "font_size": 36,
          "color": "#172B4D",
          "bold": true
        },
        {
          "id": "subtitle",
          "type": "text",
          "x": 100,
          "y": 168,
          "w": 1400,
          "h": 65,
          "text": "每个节点、标签和箭头都有独立 ID。组合后仍可取消组合编辑。",
          "font": "Microsoft YaHei",
          "font_size": 19,
          "color": "#526173"
        },
        {
          "type": "group",
          "id": "workflow",
          "name": "工作流 · 可取消组合",
          "children": [
            {
              "id": "node-a",
              "type": "shape",
              "x": 100,
              "y": 340,
              "w": 360,
              "h": 160,
              "shape": "roundRect",
              "fill": "#DCEEE9",
              "line": null
            },
            {
              "id": "label-a",
              "type": "text",
              "x": 130,
              "y": 387,
              "w": 300,
              "h": 70,
              "text": "识别元素",
              "font": "Microsoft YaHei",
              "font_size": 27,
              "color": "#172B4D",
              "bold": true,
              "align": "center"
            },
            {
              "type": "line",
              "id": "link-ab",
              "x1": 485,
              "y1": 420,
              "x2": 590,
              "y2": 420,
              "arrow": "end",
              "color": "#007F73",
              "line_width": 3
            },
            {
              "id": "node-b",
              "type": "shape",
              "x": 620,
              "y": 340,
              "w": 360,
              "h": 160,
              "shape": "roundRect",
              "fill": "#007F73",
              "line": null
            },
            {
              "id": "label-b",
              "type": "text",
              "x": 650,
              "y": 387,
              "w": 300,
              "h": 70,
              "text": "保存场景",
              "font": "Microsoft YaHei",
              "font_size": 27,
              "color": "#FFFFFF",
              "bold": true,
              "align": "center"
            },
            {
              "type": "line",
              "id": "link-bc",
              "x1": 1005,
              "y1": 420,
              "x2": 1110,
              "y2": 420,
              "arrow": "end",
              "color": "#007F73",
              "line_width": 3
            },
            {
              "id": "node-c",
              "type": "shape",
              "x": 1140,
              "y": 340,
              "w": 360,
              "h": 160,
              "shape": "roundRect",
              "fill": "#DCEEE9",
              "line": null
            },
            {
              "id": "label-c",
              "type": "text",
              "x": 1170,
              "y": 387,
              "w": 300,
              "h": 70,
              "text": "原生导出",
              "font": "Microsoft YaHei",
              "font_size": 27,
              "color": "#172B4D",
              "bold": true,
              "align": "center"
            }
          ]
        },
        {
          "id": "details",
          "type": "text",
          "x": 100,
          "y": 615,
          "w": 1400,
          "h": 120,
          "text": "修改文字和数据：更新 scene.json 后重新导出。\n修改图片：只替换对应素材，保留其他元素与布局。",
          "font": "Microsoft YaHei",
          "font_size": 24,
          "color": "#172B4D",
          "line_spacing": 1.3
        },
        {
          "id": "footer",
          "type": "text",
          "x": 100,
          "y": 795,
          "w": 1400,
          "h": 50,
          "text": "03 / 03   ·   无整页底图，所有流程元素均可编辑",
          "font": "Microsoft YaHei",
          "font_size": 14,
          "color": "#526173"
        }
      ]
    }
  ]
}
